ID_FOR;FANTASIA;CNPJ;RESPONSAVEL;INS_MUNICIPAL;INS_ESTADUAL;ENDERECO;BAIRRO;UF;TELEFONE;FAX;EMAIL;CELULAR
27;AR PONTOCOM COMERCIAL LTDA;00.187.954/0001-55;;;116515317110; DR MARIO DE ASSIS MOURA JR, 41;TATUAPÉ;;;;;
6;PANIFICAÇÃO FARIAS E GUIMARÃES LTDA;00.200.953/0001-01;;;27.087.949-8; JOSÉ FONTES DE GÓES, 119;CENTRO;;;;;
8;SANFARMA DISTRIBUIDORA E REPRESENTAÇÕES LTDA;00.895.119/0001-70;;;27.090.440-9; DEP. MATOS TELES, 501;LUZIA;;;;;
274;EDUARDO FARIA DE SANTANA;00022588540;;;;;ZONA RURAL;;;;;
125;LOGIN INFORMÁTICA COM. E REP. LTDA;00066716000272;;;27.089.491-8;AV: GONÇALO ROLEMBERG LEITE Nº 2178;PEREIRA LOBO;SE;7921067944;;;
52;PAULO COMERCIO E REPRESENTAÇÕES LTDA;00083042000133;;;270867589;AV. DESENBARCADOR MAYNARD 520;CIRUGIA;SE;;;;
106;LOJAO DOS COSMETICOS;00156225000131;;;27087402-0;PÇA JOAO XXIII;CENTRO;SE;7932143534;;;
80;GILMAR SOUZA ANDRADE;00293657000194;;;270882316;AV. CONTORNO;;;;;;
119;MARIA LEDA SILVEIRA SIMOES;00297220000129;;;270881034;RUA BENJAMIN CONSTANT - UMBAUBA;CENTRO;SE;;;;
120;DENTAL - MED COM. REPRESENTAÇOES;00304491000164;;;270880613;RUA MARUIM 443;CENTRO;SE;7932113825;;;
108;ELETRONICA NACIONAL LTDA;00416077000147;;;27088861-6;RUA CARLOS CORREIA, 569;SIQUEIRA CAMPOS ;;;;;
91;EIFFEL VEICULOS LTDA;00474492000157;;;27089152-8;RUA RAFAEL AGUIAR;CIRURGIA;SE;7921069600;;;
176;CELENA ANDRADE AVILA SANTANA;00497935000125;CREUSMAR;;;PRACA JOSE FONTES GOES 135;CENTRO;;;;;
96;MAM DISTRIBUIDORA DE ALIMENTOS LTDA;00502202000131;EDMILSON;;27120851-1;AV. DR ADEL NUNES 343;FAROLANDIA;;;;;
135;COMERCIO E MAN. BASICA EM VEICULO AUT. LTDA-ME;00607175000161;;;270891960;RUA FILADELFO ARAUJO 1296 - ITABAIANA;EUCALIPTO;SE;;;;
123;J & M CONFECÇÕES E SILK SCREEN;00773352000180;;;27.119.234-8;RUA LARANJEIRAS Nº 1342;CENTRO;SE;7930421775;;;
115;RURAL PRODUTOS AGROPECUARIOS;00974454000678;;;271218037;AV CHANCELER OSVALDO ARANHA 3122 A;OLARIA;SE;;;;
43;SOUZA PINTO E FILHO LTDA;01.655.446/0002-06;;;270934430; SAO CRISTOVAO, 187;CENTRO;;;;;
30;SERBATE SERGIPE BATERIA LTDA;01.675.822/0001-35;;;27.093.505-3; GUANABARA , 28;AMERICA;;;;;
207;LOCMAQ COM E SERV. DE MAQ E EQUIP;01139388000179;;;;RUA ZAQUEL BRANDAO;SAO JOSE;SE;;;;
71;TOYONG COM. VAR. DE PEÇAS E SERV. LTDA;01202344000146;;;271115831;AV. CHANCELER OSVALDO ARANHA;SAO JOSE;SE;;;;
132;CLEITON ARMARINHO;01577860000155;;;27.093.130-9;AV LUIZ ALVES DE OLIVEIRA FILHO;CENTRO;SE;7935412020;;;
50;MADEIREIRA SANTA LUZIA;01655376000105;YLMARA CRISTINA M. BISPO;;27.093.472-3;POV.COLONIA TREZE, 387;ZONA RURAL;SE;7936421213;;;
57;SERGIPE BATERIAS LTDA ;01675822000135;;;270935053;AV. GUANABARA, 28;AMERICA;SE;;;;
208;BOLO BOM INDUSTRIA E COMERCIO;01813345000127;;;;AVENIDA ZACARIAS JUNIOR, 335;CENTRO;SE;;;;
36;MM FARMA COMERCIAL LTDA;02.350.721/0001-57;;;270961640; NOSSA SENHORA DAS DORES, 370;CIRURGIA;;;;;
1;MANOEL DOS SANTOS ALVES;02.390.323/0001-64;;;127.096.200-0; PAULO BARRETO DE MENEZES, 88;CENTRO;;;;;
5;ANDRÉ SANTANA GUIMARÃES;02.399.554/0001-39;;;27.096.974-8; OTAVIANO OLIVEIRA SOUZA , 35;CENTRO;;;;;
26;MARTA MARIA DORIA MONTEIRO- ME;02.696.440/0001-50;;;27.109.563--6; TERENCIO SAMPAIO, 91;GERU;;;;;
2;RENOVEL VEÍCULOS LTDA;02.814.097/0001-00;;  ;27.097.484-9; ENG. GENTIL TAVARES DA MOTA, 720;GETÚLIO VARGAS ;;;;;
41;CLEAN ESSENCIAS COMERCIAL LTDA;02.884.150/0001-30;;;270994971; JOAO XXIII, 48;CENTRO;;;;;
283;PAULO ALVES DE ARAUJO;02232774520;PAULO;;;PÇA HERIBALDO ALVES DE GOES;CENTRO;;;;;
105;EQUIMED PROD.  EQUIP. MED. HOSP. OD. LTDA;02350719000188;;;27096026-0;RUA SENHOR DOS PASSOS, 602;PONTO NOVO;SE;7932310290;;;
184;L&L PARAFUSOS E FERRAGENS LTDA.;02381851000157;;;;RUA BAHIA - 664; SIQUIRA CAMPOS;SE;;;;
287;JOSE FRANCISCO SALES NASCIMENTO;02390136540;;;;POVOADO BELA VISTA;CENTRO;;;;;
64;REAL ALIMENTOS IND. COM. LTDA;02403172000131;MEIRE;;270963855;AV DESENB MAYNARD;CIRURGIA;SE;7932144782;;;
244;TRATORMASTER;02745179000212;;;;AV TIRADENTES . 659;ARACAJU - AMERICA;SE;;;;
294;R B DANTAS& CIA LTDA;02895028000917;;;271370742;RUA PEDRO F. DAS VIRGENS- UMBAUBA;CENTRO UMBAUBA;;;;;
133;VIASPORT LTDA;02987324000190;;;270981454;PÇA OLIMPIO CAMPOS, 26;CENTRO;SE;;;;
15;REPRESENTAÇÕES UNIVERSAL LTDA;03.354.611/0001-26;;;27.099.419-0; SETE DE SETEMBRO, 433;CENTRO;;;;;
33;GRAFICA E EDITORA BOQUINENSE;03.404.013/0001-14;;5400314;27.100.003-1; SIMPLICIANO DA F. FONSECA , 521;CENTRO;;;;;
39;COMERCIAL LIVROS E PAPEIS LTDA;03.471.245/0001-95;;;270998047; ITABAIANINHA, 199;CENTRO;;;;;
12;"NORDESTE REFRIGERAÇÃO LTDA
";03.731.620/0001-99;;;27.100.665-0; SÃO CRISTOVÃO, 1312;CENTRO;;;;;
16;NORDESTYLUS INDUSTRIA E COMERCIO DE MOVEIS LTDA;03.810.869/0001-90;;;27.101.871-2; GUTEMBERG CHAGAS , 280;INACIO BARBOSA;;;;;
103;DATAPEL COMERCIAL LTDA;03137082000109;;;27098497-6;AV. PROF ANISIO CRUZ, 360;SALGADO FILHO;SE;;;;
175;GAMA DISTRIBUIDORA LOG. ALIMENTO LTDA.;03389294000183;EVERALDO;;;RUA: MAMOEL DANTAS 435;JOSE CONRADO ARAUJO;;;;;
168;INFRANET TECNOLOGIA EM COMUNICAÇÃO LTDA;03553543000124;;;271086106;AV DESEMBARGADOR MAYNARD, 43;SUIÇA;;;;;
137;FLEX HOSPITALAR LTDA;03606635000125;;;271002182;RUA GARARU 1326;SUISSA;SE;7921054000;;;
178;ARACAJU GÁS;03693271000168;;;;RUA ROBERTO MORAIS;SANTOS DUMONT;;;;;
141;O MERCADÃO COMERCIO PRESTAÇÃO DE SERVIÇOS LTDA;03823107000128;;;27.101.039-8;AV GENTIL TAVARES DA MOTA Nº 51;SANTO ANTÔNIO;SE;7932150488;;;
56;LISCAR MOTOS LTDA;03835664000169;;;27.101.357-5;RUA BASÍLIO ROCHA Nº 182;GETÚLIO VARGAS;SE;7932143656;;;
54;SUPRAGAS DISTRIBUIDORA LTDA;03961814000180;;;271016450;PRAÇA GENERAL OSORIO Nº 12;CENTRO;SE;;;;
38;MAX MED COM. SERV. MED. ODONT.LTDA;04.129.977/0001-64;;;271117877; MARUIM, 386;CENTRO;;;;;
4;CARVALHO INFORMÁTICA LTDA;04.235.292/0001-00;;;27.102.267-1; MARUIM, 536;CENTRO;;;;;
22;CONSTRUPEL COMERCIAL LDTA;04.301.703/0001-00;;;27.102.498-4; SANTOS DUMONT, 222;CENTRO;;;;;
23;VITALNUTRE ALIMENTOS;04.405.244/0001-05;;;27.103.091-7; JOAO RIBEIRO, 853;STO ANTONIO;;;;;
34;EGS COMERCIO ESERVIÇOS LTDA;04.600.534/0001-00;;;27103415-7; DOUTOR PEDRO SOARES , 424;CENTRO;;;;;
266;LIV BUS  COMERCIO DE PEÇAS PARA ONIBUS;04061673000102;;;271018348;RUA RECIFE, 562;JOSE CONRADO ARAUJO;SE;;;;
186;SERGIPE VEICULOS COMERCIAL LTDA.;04067040000101;;;;POVOADO PALESTINA  N.S SOCORRO;;SE;;;;
264;ANDRE LUIZ ALMEIDA MENESES ME;04113426000102;;;271020326;PÇA DES. RINALDO COSTA E SILVA;CENTRO;;;;;
68;FAER MANGUEIRAS COMÉRCIO E SERVIÇOS LTDA;04162691000180;;;271025654;AV. CONTORNO, 4156;CENTRO;SE;;;;
288;MARCILENE SANTOS CALAZANS;04370632000106;;;271116501;AV COELHO E CAMPOS, 379;CENTRO;;;;;
110;NASCON NASCIMENTO CONSTRUÇOES;04469629000136;;;;AV DJENAL TAVARES DE QUEIROZ, 262 BOQUIM;CENTRO;SE;;;;
253;MUNDO DA REFRIGERAÇÃO;04657203000106;;;271034165;AV. MAMEDE PAES MENDONÇA;CENTRO;SE;;;;
259;AUTO POSTO REFORCO II LDA;04699734000161;;;;RODOVI BR 101, KM 179.5. 00;ZONA RURAL;SE;;;;
185;ERIVALDO MOTA DOS SANTOS;04768852000184;;;;PRAÇA CORONEL JOÃO NETO - 251;CENTRO;SE;;;;
130;RL FARMA COMÉRCIO E SERVIÇOS LTDA;04835798000142;;;27.105.508-1;RUA MARUIM Nº 456 ;CENTRO;SE;7932118751;;;
60;FLEXI DISTRIBUIDORA LTDA;04851939000110;;;56882993PP;ED. PRIMUS 303;CENTRO;BA;7133122990;;;
85;BRINKE MAIS COMERCIO DE BRINQUEDOS E EQUIPQMENTOS;04895426000101;;;27110842-8;RUA  A4  CONJ. MARCOS FREIRE I  ;MARCOS FREIRE;SE;;;;
262;REI AUTO PEÇAS;04966225000158;;;271268824;AV BRASIL, 837;;;7932416685;;;
17;AQUARELA PAPELARIA E GRAFICA LTDA;05.321.710/0001-37;;;27.106.803-5; ARAUA, 356;CENTRO;;;;;
40;EDUCAR LIVROS E COMERCIO E REPRESENTACOES LTDA;05.353.814/0001-23;;;1810010298057; DA GLORIA, 317;BOA VISTA;;;;;
10;SUPERMERCADO SANTA CLARA LTDA;05.473.902/0001-69;;;27.107.271-7; SÃO JOÃO, 240;CENTRO;;;;;
47;AUTOCAR IMPORTS PEÇAS E ACESSORIOS  LTDA;05.617.552/0001-67;;;271077271; ENG. GENTIL TAVARES , 919;CIRURGIA ;;;;;
18;DISCABOS CONECTORES PARA REDE DE TELEINFORMATICA L;05.623.375/0001-21;;;27.107.819-7; GONÇALO ROLEMBERG LEITE, 2451;LUZIA;;;;;
14;MOVEIS ESTOFADOS JG LTDA;05.814.920/0002-48;;;27.109.775-2; SIMPLICIANO FERNANDES DA FONSECA, 2;CENTRO;;;;;
102;FONTACQUA COMERCIO LTDA -ME;05000589000141;;;27106148-41;RUA ESTANCIA - UMBAUBA  SERGIPE;CENTRO;SE;;;;
136;FRIGOR FRIOS COMERCIO LTDA -ME;05043713000156;;;271065036;LGO CORONEL JOSE VICENTE, 26;CENTRO;SE;;;;
48;PEREIRA AUTO CENTER LTDA;05058340000197;;;27.106.151-0;RUA MARIANO SALMERON;SIQ. CAMPOS;SE;7932417878;;;
51;COMERCIAL 3 IRMAOS;05061731000160;ARDENILTO VILANOVA;;127.106.023-9;PRAÇA JOSE FONTES DE GOES, 80;CENTRO;SE;7936481511;;;
173;SERGIPE TECNOLOGIA EM INFORMATICA LTDA;05146651000108;;;;RUA DR JOSE SILVA RIBEIRO;AMERICA;SE;;;;
202;EDUARDO TELES DANTAS -MILAMASSAS;05165578000111;;;;RUA PROFESSOR JOSE DE LIMA PEIXOTO;;SE;;;;
66;NEW CENTER COMERCIAL LTDA;05243614000118;;;;RUA LARANJEIRAS,604;CENTRO;SE;;;;
84;NANATEX IND. COM. LTDA .;05500671000135;;;271074450;RUA MANOEL DOS SANTOS;CENTRO;;;;;
144;DAUTOCAR IMPORTS;05617552000167;;;27.107.727-1;AV. ENG GENTIL TAVARES, Nº 919 SL A TÉR;CIRURGIA;SE;7932222222;7932222223;;
215;MW COMERCIAL DISTRIBUIDORA E SERVIÇOS LTDA EPP;05686544000172;;;;RUA SÃO CRISTOVAO, 320;CENTRO ARACAJU;SE;;;;
302;LAR DAS CONSTRUÇOES;05741515000166;;;271081708;RUA BENJAMIM CONSTANT, 12, UMBAUBA;CENTRO;SE;;;;
90;MACHADO E CAMARGO LTDA;05745686000163;;;;AV. PAULO BARRETO DE MENESES - BOQUIM;CENTRO;SE;;;;
25;LUIZ CARLOS BARRETO SILVA -ME;06.077.957/0001-12;;;27.109.096-0; SIMPLICIANO F. FERNANDESDA FONSECA, 6;CENTRO;;;;;
142;M & N ODONTOMEDICAL COM. EQUI. MÉDICO ODONTO E HOS;06040597000184;;;27.110.274-8;AV DOUTOR EDÉSIO VIEIRA DE MELO Nº 1098;SUIÇA;SE;7932214136;;;
227;CASA DO SERRALHEIRO LTDA;06078207000165;;;;RUA MIZAEL VIEIRA, 335;CENTRO LAGARTO;SE;;;;
126;LITORÂNEA LIVRARIA E PAPELARIA LTDA;06186537000174;;;27.109.400-1;RUA SANTO AMARO Nº 289;CENTRO;SE;7932116323;;;
93;AGONORDESTE COMERCIAL LTDA;06968279000188;;;271102489;RUA ESTANCIA 568  - UMBAUBA;CENTRO;SE;;;;
29;LUIZ CARLOS PNEUS E SERVIÇOS LTDA ME;07.094.639/0001-22;;;; HERMES FONTES , 80;CENTRO;;;;;
35;LUAN MED PRODUTOS HOSPITALARES LTDA;07.369.076/0001-38;;;271115653; ESTRADA DA LUZIA, 185;LUZIA;;;;;
42;NB COMERCIO ATAC. DE ART. ARM. LTDA;07.412.997/0001-36;;;271117664; ESPIRITO SANTO, 766;SIQUEIRA CAMPOS;;;;;
67;victória distribuidora de livros;07040879000144;;;27.110.476-7;rua frei josé da santa cecília  nº 128;siqueira campos;SE;7932590864;;;
117;RFLC QUIKCKARTUCHOS LTDA;07180998000100;;;271109572;RUA CAPITAO SALOMAO 75  ESTANCIA;CENTRO;SE;;;;
92;SODUCATO AUTO PEÇAS E SERVIÇOS;07218392000109;;;271192038;TV AMAPA,  ARACAJU;SIQUEIRA CAMPOS;SE;;;;
187;DIANJU - DISK ATACADISTA LTDA-EPP;07226206000183;;;;AV.DR. JOSÉ DA SILVA RIBEIRO FILHO - 740;AMERICA;SE;;;;
101;ROSELIA DOS SANTOS NASCIMENTO;07241686000151;;;;PÇA PROFESSORA DIVA, 62;CENTRO;SE;;;;
301;SOVALVULAS COM. DE VALV. E SERV. LTDA;07253090000171;;;271112506;AV. OSVALDO ARANHA, 631;NOVO PARAISO;;7931799606;;;
95;JRC  MOTOPEÇAS LTDA ME - ERALDO MOTOS;07279885000159;ERALDO;;27111294-8;AV SANTOS DUMONT 01;CENTRO;SE;7936481214;;;
297;JHS DIESEL TRANSPORTE AUTO PEÇAS ;07328830000191;;;271115726;ROD BR 101, N. S. SOCORRO -SE;PALESTINA;SE;;;;
128;GUEGUÊ MOTOS;07335941000125;;;27.111.751-6;AV: ENGENHEIRO JOEL FONTES COSTA Nº 228 ;CENTRO;SE;7936451464;;;
203;SUPERMERCADO JB LTDA.;07498042000143;;;;PC VENANCIO FERNANDES DA FONSECA, 10;CENTRO;SE;;;;
78;TEXTIL NORDESTE E COM DE CONFECÇÕES LTDA;07581405000100;;;27112500-4;RUA JOSÉ PRIMO Nº 31 GALPÃO- CONJ. ALBAN;CENTRO;AC;7935441349;;;
209;MACÊDO E CRUZ COMERCIO DE EMBALAGENS E FRIOS LTDA.;07588823000129;;;;RUA AULCRO MOTA, 572;CENRO;SE;;;;
53;IMPRESJET IMPRESSORAS & MICROS;07633539000127;RAFAEL;;27.112.308-7;RUA CAPITÃO SALOMÃO , 96 A;CENTRO;SE;7935224203;7935224203;www.impresjet.com.br;7988090857
79;IMMERSION;07716623000104;;;271128933;SITIO ITAPICURU, ITABAIANINHA ;CENTRO;SE;;;;
289;J.E. MATERIAL ELETRICO E CONSTRUÇÃO LTDA;07753014000125;;;271128887;RUA CAPELA, 385;CENTRO;;;;;
206;FERRAMENTAS CIA COMERCIAL LTDA;07767093000123;;;;RUA MARIANO SALMERON;SIQUEIRA CAMPOS;SE;;;;
31;PEMAGRI PEÇAS E MAQUINAS AGRICULAS LTDA;08.489.098/0002-85;;;27.106.784-5; BR 101 KM 92, 214;PARQUE DOS FAROIS;;;;;
258;COMFESEL - COML. DE FERRAGENS SERGIPANA LTDA ME;08109303000159;;;;AVENIDA ROTARY, 360;CENTRO;SE;;;;
189;ALLDOC EQUIPAMENTOS DE INFORMATICA LTDA. EPP;08139775000154;;;;AV. HERMES FONTES - 144;SUISSA;SE;;;;
161;PYAZA INDUSTRIA E COMÉRCIO DE UNIFORMES LTDA-ME;08155583000131;;;27.113.620-0;LARGO MARIO PIRES Nº 70;CENTRO;SE;;;;
138;VIP MED COMÉRCIO DE MATERIAL HOSPITALAR LTDA;08156693000118;;;27.116.433-6;RUA ARAUÁ Nº 805;SÃO JOSÉ;SE;7932146073;;;
226;CITEC PREMOLDADOS E MATERIAIS DE CONSTRUÇAO LTDA;08157959000147;;;;RUA EULINA LIMA DOS D=SANTOS - 30;OLARIO - ARACAJU;SE;;;;
171;MATEUS FLORES E COMPANHIA;08271351000149;;;271166550;RUA 51, ;EDUARDO GOMES;SE;;;;
219;SOARES E SOARES FLORES E DECORAÇOES;08289907000124;;;;AV. ANISIO AZEVEDO, 378. ARACAJU;TREE DE JULHO;;;;;
290;INCOMEX IND COM DE CON. E SERV. LTDA;08314180000198;;;271179333;rua recife ;jose conr araujo;SE;;;;
113;RURAL MAQUINAS LTDA;08321073000197;;;271188480;CHANCELER OSVALDO ARANHA, ARACAJU;;SE;;7932525163;;
247;SAMIRES TRINDADE DE ALMEIDA MICROEMPRESA -ME;08338005000130;;;271193441;RUA BENICIO FREIRE, 11 ITABAIANINHA;CENTRO;SE;;;;
97;SERBA COMERCIO DE ALIMENTOS LTDA;08463296000199;FATIMA;;;RUA FILOMENO FRANCO FREIRE,324;PONTO NOVO;SE;7932170252;;;
216;SULPECAS-PECAS TRATORES E CAMINH. LTDA ME;08543668000197;;;;RUA ESTANCIA, 152;BR 101 UMBAUBA;SE;;;;
99;M. & D ESQUADRIAS DE FERRO ALUM. LTDA;08630300000166;;;271191040;AV. JOSE CARLOS MACHADO 1150;CENTRO ;SE;7936451451;;;
145;ANGRA AUTO PEÇAS LTDA;08647238000115;;;27.119.112-0;RUA MARIANO SALMERON  Nº;SIQUEIRA CAMPOS;SE;7932114741;;;
94;LUCIANO FLORO OLIVEIRA;08675461000176;;;271192992;AV. CHANC. OSV. ARANHA;N. PARAISO;SE;7932411260;;;
255;TOTOK BORDADOS E UNIFORMES;08794531000105;;;;AV. PRESIDENTE VARGAS, 445;PRATAS;SE;;;;
293;SHOPPING ESCOLAR LTDA- ME;09275315000116;;;271213027;AV. GETULIO VARGAS;CENTRO;;;;;
129;MERCEARIA SENHOR DO BOMFIM;09360438000155;;;27.121.854-1;RUA JOÃO MACEDO Nº 212 CASA;CENTRO;SE;;;;
159;MINGO SILK SCREEN E ESTAMPARIA;09492188000107;JOSÉ DOMINGOS;;27.122.407-0;PRAÇA DA LARANJA Nº116 SALA 01;CENTRO;SE;7936451692;;;
140;SOBRINHO SPORTES;09492706000192;NEUDO SOBRINHO;;27.122.002-3;TRAVESSA ALVARO DE FREITAS;CENTRO;SE;7936482020;;;
112;COMERCIAL VASCONCELOS;09521183000165;;;271227893;PÇA VENANCIO FONSECA, 7  BOQUIM;CENTRO;SE;;;;
180;SUPERMERCADO UNIBOM;09569327000153;;;;PRAÇA EPITAFIO GOES, 169;;;;;;
229;CONSTRUHIPER ;09588818000141;;;;AV PAULO BARRETO DE MENEZES, 766;CENTRO BOQUIM;SE;;;;
210;KADU BABY ARTIGOS INFANTIS LTDA;10247699000142;;;;AV: LUIZ ALVES DE O. FILHO, ;CENTRO;SE;;;;
109;A&M COMERCIO DE ARTIGOS OPTICA LTDA;10266289000149;;;;RUA  DR LAUDELINO FREIRE;;;;;;
265;ELETRICA ALIANCA;10344401000112;;;271230045;AV CARLOS BURLAMARQUI, 109;ARACAJU;SE;;;;
246;CENTRAL DE LIVROS JURIDICOS DO BRASIL;10396694000181;;;41546199118;RUA JOSE DE GOES PINTO,35;JD UNIVERSITARIO;SP;1935718624;;;
225;CLAUDSON CARDOSO GUIMARAES ME;10556554000123;;;;RUA JOSE DA COSTA 2 A;UMBAUBA - CENTRO;SE;;;;
201;E.C. RODRIGUES PERES LIVROS ME;11025235000154;;;;RUA ANGELO TANTIN, 516;BIRIGUI;SP;;;;
179;CONFECÇÕES ÁGUIA COMÉRCIO E INDUSTRIA LTDA ME;11053265000174;;;;RUA MARIANO SALMERON 710;;;;;;
181;JVC COM VAR. PAPELARIA & EQUIPAMENTOS;11143032000162;;;271258918;RUA EUCLIDES PAES MENDONÇA;;;;;;
228;CONSTRUARTE IND ;11365393000153;;;;RUA ESTANCIA , 793;CENTRO, UMBAUBA;SE;;;;
190;TECHNOTRONIC CURSOS DE INFORMATICA LTDA.;11681159000135;;;;RUA:ROSARIO CARVALHO, 47;CENTRO;SE;;;;
254;TRANSRIO;11726521001208;;;;ROD BR, KM 92, S/N ;PALESTINA;SE;;;;
191;NAR DOCES E DECORAÇÕES LTDA. -ME;11864947000167;;;;TRAVESSA OTONIEL SILVEIRA, 17;CENTRO;SE;;;;
230;COMERCIO DE FRUTAS CLEO E CLEI LTDA ME;11979016000104;;;;AV PAULO BARRETO DE MENEZES, 896;CENTRO BOQUIM;SE;;;;
236;MESSIAS SILVA DE MATOS - ME;12117398000120;;;;AV DEP JOSE CONDE SOBRAL, 335A;CENTRO, ITAPORANGA;SE;;;;
205;ASSOCIAÇAO COMUN. DOS AGRICULTORES DE PEDRINHAS;12296159000184;;;;POV. BUENOS AIRES;.;SE;;;;
199;ANDRADE E ANDRADE ;12357054000198;;;;RUA-GABRIEL J. DE GOIS- 274;CENTRO- PEDRINHAS;SE;;;;
13;GRAFICA E EDITORA J. ANDRADE LTDA;13.007.646/0001-42;;;; LAGARTO, 322;CASA;;;;;
11;PREFEITURA MUNICIPAL DE PEDRINHAS;13.098.736/0001-96;;;; HERIBALDO ALVES DE GOIS, 8;CENTRO;;;;;
44;GS COMERCIO DE LIVROS LTDA;13.946.298/0001-79;;;270648569; MARUIM, 361;CENTRO;;;;;
116;CASA AVILA;13003991000108;;;270625836;RUA CAPELA, 40;CENTRO;SE;;;;
260;SOCIMEL - SOCIEDADE IMPORTADORA MERCANTIL LTDA;13004056000166;;;270000550;AV COELHO E CAMPOS, 387;CENTRO;SE;7932119572;;;
49;JULIO PRADO SUPERMERCADOS;13005053000147;FERNANDO;;27.076.485-2;AV. DR. JOSE DA SILVA R. FILHO, 700;AMERICA;SE;7921063321;7921061033;;
182;CASA SANTA ROSA LTDA;13006366000624;;;;AV. AIRTON TELES, 755;SANTO ANTONIO;SE;;;;
104;OTICA SANTANA LTDA;13007422000211;;;;AV BARAO DE MARUIM, 575;CENTRO;SE;;;;
183;CARDOSO & CIA LTDA;13007695000185;;;;AV. OTONIEL DOREA - 490;CENTRO;;;;;
127;CERQUEIRA PEÇAS;13083621000128;;;27051772-3;RUA LARANJEIRAS Nº 593;CENTRO;SE;7932143294;;;
222;SUPERMERCADO PRADO VASCONCELOS LTDA;13086046000893;;;;PRACA HERIBALDO ALVES DE GOIS N 60;CENTRO;SE;;;;
170;JOSE CARVALHO DOS SANTOS;13091756000135;;;270530665;PÇA GEREMIAS MONTEIRO;CENTRO ;SE;;;;
98;ELIZAUDO FONTES OLIVEIRA;13095450000157;;;;RUA DJALMA DUTRA, 346;CENTRO ;SE;7936481212;;;
169;IRMÃOS BARBOSA LTDA DROGARIA JB;13095625000398;;27.062.553-4;27.062.553-4;PRAÇA LEANDRO MACIEL S/N;CENTRO;SE;7936481235;;;
188;AZAN COMERCIAL LTDA;13105143000100;;;;PRAÇA ROSENDO RIBEIRO DE SOUZA - 26;CENTRO;SE;;;;
157;SAMAM VEÍCULOS LTDA;13136197000132;;;27.053.765.1;RUA BASÍLIO ROCHA Nº 89;GETÚLIO VARGAS;SE;7932127000;;;
61;FRAMADIAS FARMÁCIA SANTA RITA DE CÁSSIA;13137898000196;;;270538208;RUA EURICO MONTEIRO ALVES, Nº 15;CENTRO;SE;;;;
200;AGROVEL AGRICULTURA E VETERINARIA LTDA.;13161435000160;;;;AV. COELHO E CAMPOS, 455 ;CENTRO;SE;;;;
213;MAJOR CAMERCIAL DE DOCES LTDA;13354725000120;;;;PRAÇA SOA JOAO XXIII , 42;CENTRO ARACAJU;SE;;;;
111;RESENDE & PEIXOTO ARMARINHO LTDA;13358056000164;;;270620567;AV MAMEDE PAES MENDONÇA, 347;CENTRO;SE;7932142909;;;
86;VIDROLANDIA LTDA;13359526000104;;;27062210-1;AV. HERMES FONTES 417;SAO JOSE ;SE;7932143772;;;
156;PETRAMAQ PEÇAS PARA TRATORES E MÁQUINAS LTDA.;13376116000171;;27.063.669-2;;AV CHANCELER OSVALDO ARANHA Nº 641;B NOVO PARAÍSO;SE;7940098500;7940098510;;
250;CASA DOS MOTORES LTDA;13382635000142;;;27064116-5;AV CONTORNO,4196;CENTRO;;;;;
256;R CLAUS COMERCIO CONSTRUÇAO E REPRESENTAÇAO ;13384470000148;;;;R A CONJUNTO JOSÉ MARTINS DE SANTANA,10;CENTRO;SE;;;;
257;JJ IMPRESSÃO VIASUAL LTDA-ME;13446692000148;;;;RUA PEREIRA LOBO, 057;CENTRO;SE;;;;
261;MERCADINHO D&G LTDA -ME;13536154000144;;;271316349;RUA JOAO MACEDO,212;CENTRO;;;;;
296;CAROLINE FONSECA FERNANDES;14039255000172;;;271399333;PÇA HERMES FONTES;CENTRO;;;;;
275;COMALCOMERCIAL DE ALIMENTOS LTDA;14907178000125;;;271354690;RUA MATO GROSSO  435;;;;;;
32;DROGADIAS LTDA -ME;15.617.806/0001-09;;;27060969-5; BAIXA , 22;CENTRO;;;;;
121;E.G MATERIAL ELETRICO LTDA - MISTAO;15039118000109;EVERALDO;;270652310;AV AUGUSTOFRANCO 3150;PONTO NOVO;SE;7932340600;;;
174;GURUPI MADEIRAS;15065907000106;;;;AV.GOV JOÃO ALVES FILHO;;;;;;
249;JOSE CLEVES DE OLIVEIRA ME;15082217000165;;;270662499;AV MARANHAO,2816;SANTOS DUMONT;SE;;;;
118;SALES MATERIAL DE CONSTRUÇÃO LTDA;15082514000100;;;270663517;AV AUGUSTO FRANCO ;SIQUEIRA CAMPOS;SE;;;;
245;MEGGA AUTO PEÇAS LTDA;15153478000129;;;271356421;AV. CHANCELER OSVALDO ARANHA;JOSE C. ARAUJO;SE;7932411388;;;
160;CASA DO ALUMÍNIO VASCONCELOS;15581085000116;;;27.057.502-2;AV. WALTER FRANCO Nº 108;CENTRO;SE;7936311836;;;
143;AUTO PECAS MACEDO;15583552000147;;;270575235;RUA MARIANO SALMERIN 48;SIQUEIRA CAMPOS;SE;7932161850;;;
114;ITAMOTOS LTDA;15604390000186;;;270599711;AV CONTORNO 334/356;CENTRO;SE;;;;
20;LOJAS INSINUANTE LTDA;16.182.834/0210-11;;;27.110.655-7; ITABAIANINHA, 189;CENTRO;;;;;
158;EKIPECAR PEÇAS E ACESSÓRIOS LTDA;16216731000109;;;27.069.427-7;AV NICOLAU ALMEIDA Nº 75;CENTRO;SE;7936311858;;;
281;SKORPIOS AUTOPLACAS LTDA ME;16223471000107;;;;AV DEJANIRO JONAS  900;CENTRO;SE;;;;
231;COFECCOES LIBORIO E FILHOS LTDA;16467623000109;;;;TRAV. JOANA ROSA, 30;CENTRO LAGARTO;SE;;;;
299;DISTRIBUIDORA FERREIRA;17140964000138;;;271389630;RUA TENENTE CLETO CAMPELO,397;18 DO FORTE;;;;;
276;ARTHUR ORLANDO CARIBE NETO;18722056000115;;;271418451;ALAMEDA  ABAIS, 283;BEIRA MAR;SE;;;;
271;XISTO ;19947763587;XISTO;;;POVOADO BELA VISTA;ZONA RURAL;;;;;
282;GIVANILDO MACEDO DA ROCHA AUTOPEÇAS-ME;20208082000171;;;;ROD POVOADO SAMBAIBA, 22 ITAPICURU;RODOVIA;BA;;;;
172;ANTIRES MENEZES DOS SANTOS;20730099010742;;;;RUA ARIBALDO ALVES DE GOES, 04;CENTRO;SE;;;;
298;CG COMERCIO LTDA;23148989000180;;;271499346;RUA LARANJEIRAS,555;CENTRO;;7932140647;;;
272;ARISTON  ALVES SANTOS;23179813504;;;;RESIDENCIAL CHICO DE GONZAGA;ZONA  URBANA;;;;;
46;AUTO PEÇAS BOMFIM;32.836.157/0001-48;;;270815651; DR. JESSÉ FONTES , 388;CENTRO;;;;;
24;CLAUDIONOR DE VASCONCELOS E CIA LTDA;32.872.251/0001-52;;;27.084.023-0; VENANCIO F. DA FONSECA, 7;CENTRO;;;;;
37;BETH MED PROD. MED. HOSPITALARES LTDA;32.872.368/0001-36;;;270844155; RIO GRANDE DO SUL, 823;SIQUEIRA CAMPOS;;;;;
3;REIS COMÉRCIO REPRESENTAÇÕES LTDA  ;32.878.407/0001-02;;;27.085.629-3; MARANHÃO , 1480;SANTOS DUMONT;;;;;
9;AUTO PEÇAS HOLANDA LTDA;32.892.416/0001-58;;;27.085.669-2; SIRIRI, 2;CENTRO;;;;;
7;ODONTO-MED COMERCIO E REPRESENTAÇOES LTDA;32.892.929/0001-69;;;27.086.254-4; ARMINDO GUARANÁ, 579;SANTO ANTÔNIO;;;;;
89;ARQUIMEDES OLIVEIRA LIMA;32707481000166;;;270722157;RUA GENERAL SIQUEIRA;CENTRO;SE;;;;
59;CRISFARMA COM. REP. LTDA;32734295000116;;;270759239;RUA TEIXEIRA DE FREITAS;CENTRO;SE;7932124800;;;
124;DUPLICHAVES COMERCIAL LTDA-ME;32739278000171;;;27.075.163-7;RUA LARANJEIRAS  Nº 399;CENTRO;SE;7932145096;;;
87;JUBS& CIA LTDA;32751273000164;RAILSON;;270753915;AV. SIMPLICIANO FERNANDES FONSECA;CENTRO;SE;7936451218;;;
139;TRATOR PEÇAS COMÉRCIO LTDA;32756694000188;;;27.075.910-7;AV CHANCELER OSVALDO ARANHA;NOVO PARAÍSO;SE;7932413313;;;
55;PRO MED COM. IND. DE PROD. MED. E HOSP;32773418000128;;;27.077.028-3;RUA SÃO CRISTOVÃO Nº 937;CENTRO;SE;7921070000;7921070001;promed@promed.com.br;
214;INDUSTRIA DE CONFECCOES L & A LTDA;32800062000174;;;;RUA SAO JOAO VILA NETO, 54;D.I.A  ARACAJU;SE;;;;
69;COMERCIAL MARATÁ LTDA;32809139000177;;;270797742;RUA ASCENDINO GARCEZ, 340;CENTRO;SE;7936319229;;;
204;ACNV UTILIDADES DOMESTICAS LTDA;32829517000184;;;;TRAVESSA JOANA ROSA, 103;CENTRO, LAGARTO;SE;;;;
131;TATU PANO LTDA;32851115000186;;;27082262-3;AV: LUIZ ALVES DE OLIVEIRA FILHO Nº 373;CENTRO;SE;7935411116;;;
122;CARLOS ANTONIO DIAS - TON. MADEIRA;32857419000150;CARLOS ANTÔNIO DIAS DA SILVA;;27.082.921-0;AV SIMPLICIANO FERNANDES FONSECA Nº 695;CENTRO;SE;7936451692;;;
107;PISOLAR COMERCIO DE TINTAS LTDA;32868002000193;;;27102915-3;AV. GONÇALO ROLEMBERG LEITE, 2112;SUIÇA;;7932346667;;;
100;SERPAF FERRAGENS E FERRAMENTAS LTDA;32868424000240;;;270888705;MARIANO SALMERON 346;CENTRO;SE;;;;
295;SMS MATERIAL DE CONSTRUÇÃO LTDA ;32874281000106;;;270846336;AV SIMPLICIANO F DA FONSECA;CENTRO;SE;;;;
134;GERONIMO TRINDADE ME;32875924000128;GERONIMO;;271217758;RUA JOSE VIEIRA DAVILA ;CENTRO;SE;;;;
65;CAROL COMERCIO LTDA;32876724000190;;;270958045;RUA GERU ;CENTRO;SE;;;;
177;BATERAUTO PEÇAS E SERVIÇOS LTDA.;32887903000122;;;;AV. PAULO BARRETO DE MENEZES;;;;;;
45;G BARBOSA COMERCIAL LTDA;39.346.861/0008-38;;;271052643; DARIA BARRETO, 23;CENTRO;;;;;
270;Maria do Carmo Santos Silva;42583993534;;;;TV ALVARO DE FREITAS;CENTRO;SE;;;;
269;FAZENDA ESPERANÇA;48555775000826;;;332141632114;RUA JOAO FRANCISCO DOS SANTOS -;GUARATINGUETA- SP;SP;;;;
300;ALBINO SILVA SANTOS;55637949549;;;;POVOADO BELA VISTA;ZONA RURAL;;;;;
273;JOSE AVELARQUE A. GABRIEL;55757618515;;;;POVOADO MUTUMBO;ZONA RURAL;;;;;
263;MERSEDES-BENS;63411623000177;;;;ROD BR 101 KM 92 SN;PALESTINA;SE;;;;
58;COMERCIAL CIRÚRGIA RIOCLARENSE LTDA;67729178000220;;;0629965800021;AV: JOSÉ CÂNDIDO DA SILVEIRA Nº 497;CIDADE NOVA;SE;3134654300;3134654301;;
19;"JOSE DE ANDRADE










";719.676.215-00;;;; POVOADO RIO DAS PEDRAS, 100;ZONA RURAL;;;;;
192;CASA DAS VEDAÇÕES E HIDRAULICA LTDA;74010372000135;;;;RUA: ACRE- 1501;CENTRO;SE;;;;
28;ELDORADO SUPERMERCADO LTDA;86.933.280/0001-06;;;27.086.477-6; COLETORA A, 1149;MARCOS FREIRE I;SE;;;;
162;ADMINISTRAÇAO E FINANCAS;88888888888881;;;;;;;;;;
163;SEC. MUNICIPAL DE SAUDE;88888888888882;;;;;;;;;;
164;SEC. MUNICIPAL DE EDUCAÇAO;88888888888883;;;;;;;;;;
165;SEC. MUNICIPAL DE AÇAO SOCIAL;88888888888884;;;;;;;;;;
166;GABINETE DO PREFEITO;88888888888885;;;;;;;;;;
167;SEC. MUNICIPAL DE OBRAS;88888888888886;;;;;;;;;;
21;JOSEMARCOS SANTOS;967.241.025-53;;;; POVOADO CAMPESTRE, 86;ZONA RURAL;TO;;;;
70;JOSÉ MARCOS SANTOS;96724102553;;;;POV. CAMPESTRE;ZONA RURAL;SE;;;;
88;SALDO INICIAL DO ALMOXARIFADO;99999999999999;;;;;;SC;;;;
